{
  "manifest": {
    "kind": "directive.missionGraph",
    "schemaVersion": 1,
    "id": "breckenridge.ashes-of-peace.prelude-a-ship-underway",
    "packageId": "directive:campaign-package:breckenridge-ashes-of-peace",
    "campaignId": "ashes-of-peace",
    "missionId": "prelude-a-ship-underway",
    "title": "A Ship Underway",
    "version": "0.3.0-pre-alpha.1",
    "status": "pre-alpha"
  },
  "sources": [
    {
      "title": "Directive Ashes of Peace Campaign v0.2",
      "path": "docs/source/Directive_Ashes_of_Peace_Campaign_v0.2.md",
      "version": "0.2",
      "role": "mission-source"
    },
    {
      "title": "Ashes Of Peace Campaign",
      "path": "docs/campaigns/ASHES_OF_PEACE_CAMPAIGN.md",
      "role": "implementation-baseline"
    },
    {
      "title": "Mission Director Model",
      "path": "docs/design/MISSION_DIRECTOR_MODEL.md",
      "role": "mission-direction-rules"
    }
  ],
  "missionFrame": {
    "function": "Introduce the player as the permanent XO joining a functioning but not yet integrated Breckenridge command culture.",
    "dramaticQuestion": "What kind of executive officer has joined the ship?",
    "startStardate": 53049.2,
    "baselineEndStardate": 53076.6,
    "startLocation": "breckenridge.rendezvous-waypoint",
    "transitionToMissionId": "chapter-1-the-empty-convoy",
    "failurePolicy": {
      "campaignMustContinue": true,
      "forbiddenOutcomes": [
        "destroy the Breckenridge",
        "remove a senior officer from play",
        "prevent Ashes of Peace from beginning",
        "punish the player with a bad start disconnected from visible causes"
      ],
      "allowedCosts": [
        "minor ship technical debt",
        "delayed arrival",
        "reduced professional confidence or integrity trust",
        "persistent transfer-cohort tension",
        "Starfleet administrative questions concerning the Hesperus",
        "one unavailable shuttle, system limitation, or personnel restriction in Chapter 1"
      ]
    }
  },
  "phases": [
    {
      "id": "shuttle-rendezvous",
      "title": "Shuttle Rendezvous",
      "type": "arrival",
      "dayRange": "day 0",
      "summary": "The Breckenridge drops to impulse at the transfer waypoint and receives the player's shuttle as a working ship, not a ceremonial reception.",
      "directorPurpose": "Establish ship condition, working routines, Priya's coordination role, Bronn's acting-XO status, and the player's first command tone.",
      "playerFacingObjectives": [
        "Come aboard",
        "Choose whether to report, inspect, or let the transfer complete first"
      ],
      "factsIntroduced": [
        "ship.post-refit-shakedown-underway",
        "crew.acting-xo-handoff",
        "ship.provisional-routines"
      ],
      "decisionPointIds": [
        "decision.arrival-tone"
      ],
      "exitSignals": [
        "The player is aboard",
        "Whitaker is ready for the private handover"
      ]
    },
    {
      "id": "ready-room-handover",
      "title": "Ready-Room Handover",
      "type": "handover",
      "dayRange": "day 0",
      "summary": "Whitaker welcomes the player privately, then Bronn formally transfers executive authority without ceremony or resentment.",
      "directorPurpose": "Define the command relationship, what Whitaker delegates, what Bronn made provisional, and how disagreement should be handled.",
      "playerFacingObjectives": [
        "Receive command intent",
        "Complete acting-XO handoff",
        "Optionally define or reveal one personal Value"
      ],
      "factsIntroduced": [
        "crew.acting-xo-handoff",
        "crew.transfer-cohort-tension"
      ],
      "decisionPointIds": [
        "decision.handover-value"
      ],
      "exitSignals": [
        "The player understands executive authority",
        "Bronn has transferred active XO responsibility"
      ]
    },
    {
      "id": "senior-readiness-conference",
      "title": "Senior Readiness Conference",
      "type": "briefing",
      "dayRange": "day 1",
      "summary": "Every department presents one unresolved concern from the first twenty-five days of transit.",
      "directorPurpose": "Force prioritization across flight, operations, tactical, science, medical, and engineering without a perfect schedule.",
      "playerFacingObjectives": [
        "Set readiness priorities",
        "Decide what to delegate",
        "Name what risk is explicitly accepted"
      ],
      "factsIntroduced": [
        "crew.transfer-cohort-tension",
        "ship.provisional-routines",
        "ship.combined-load-risk"
      ],
      "decisionPointIds": [
        "decision.readiness-priorities"
      ],
      "exitSignals": [
        "A schedule or prioritization stance exists",
        "At least one explicit accepted risk or deferred concern is recorded"
      ]
    },
    {
      "id": "fallback-command-drill",
      "title": "Fallback-Command Drill",
      "type": "drill",
      "dayRange": "day 2",
      "summary": "Bronn's security exercise exposes incompatible emergency habits and a real command-network certificate issue.",
      "directorPurpose": "Test whether the player can create survivable command clarity without blaming personnel for system-design mismatch.",
      "playerFacingObjectives": [
        "Resolve the drill result",
        "Choose temporary or permanent procedure",
        "Decide whether to repeat part of the drill"
      ],
      "factsIntroduced": [
        "ship.fallback-command-incompatibility",
        "ship.command-network-certificate-issue"
      ],
      "decisionPointIds": [
        "decision.fallback-procedure"
      ],
      "exitSignals": [
        "A fallback-command policy exists for the remaining transit",
        "Technical remediation is assigned or deferred"
      ]
    },
    {
      "id": "command-rhythm-scenes",
      "title": "Command Rhythm Scenes",
      "type": "freeform",
      "dayRange": "days 3-4",
      "summary": "Two or three focused scenes establish the player's command rhythm with senior staff and provisional routines.",
      "directorPurpose": "Let the player learn the crew through authority, delegation, and concrete problems rather than biography tours.",
      "playerFacingObjectives": [
        "Chair a focused meeting or follow-up",
        "Review one or more department pressures",
        "Set expectations for how officers bring concerns"
      ],
      "factsIntroduced": [
        "ship.provisional-routines",
        "crew.transfer-cohort-tension"
      ],
      "decisionPointIds": [],
      "exitSignals": [
        "At least two senior officers have had meaningful operational contact with the player",
        "The Director has recorded one command-culture tendency"
      ]
    },
    {
      "id": "hesperus-diversion",
      "title": "The Hesperus Diversion",
      "type": "containedMission",
      "dayRange": "day 5",
      "summary": "The Breckenridge detects the S.S. Hesperus on emergency power with vulnerable passengers, a failing plasma injector, and falsified maintenance paperwork.",
      "directorPurpose": "Present an ordinary rescue and accountability problem disconnected from Pale Lantern, with freeform solutions and real cost.",
      "playerFacingObjectives": [
        "Assess passenger risk",
        "Choose a response to the Hesperus",
        "Handle inspection fraud without making passengers carry the whole cost"
      ],
      "factsIntroduced": [
        "hesperus.no-hostile-actor",
        "hesperus.passenger-risk",
        "hesperus.inspection-fraud",
        "hesperus.plasma-injector-failing",
        "hesperus.escape-pod-subspace-data"
      ],
      "decisionPointIds": [
        "decision.hesperus-response",
        "decision.inspection-fraud-accountability"
      ],
      "exitSignals": [
        "Passengers and crew have a plausible safety plan",
        "Engineering, medical, time, and legal consequences are committed"
      ]
    },
    {
      "id": "hesperus-aftermath",
      "title": "Hesperus Aftermath",
      "type": "aftermath",
      "dayRange": "day 6",
      "summary": "The Hesperus decision produces follow-up work for engineering, medical, security, operations, flight planning, and science.",
      "directorPurpose": "Turn the rescue choice into persistent ship, crew, and administrative consequences without connecting it to the main conspiracy.",
      "playerFacingObjectives": [
        "Assign follow-up work",
        "Choose one private or B-plot scene if pacing permits"
      ],
      "factsIntroduced": [
        "hesperus.inspection-fraud",
        "hesperus.escape-pod-subspace-data"
      ],
      "decisionPointIds": [],
      "exitSignals": [
        "Hesperus consequences are recorded",
        "Arrival schedule margin is updated"
      ]
    },
    {
      "id": "combined-load-test",
      "title": "Combined-Load Test",
      "type": "test",
      "dayRange": "days 7-8",
      "summary": "The final shakedown event combines high sensor load, tactical readiness, emergency-power transfer, and controlled warp-field changes.",
      "directorPurpose": "Test whether the player treats technical irregularities as ordinary causal problems and makes readiness reporting honest.",
      "playerFacingObjectives": [
        "Choose whether to continue, pause, shift control, accept a workaround, or report incomplete testing",
        "Resolve Kieran's flight profile in operational context"
      ],
      "factsIntroduced": [
        "ship.command-network-certificate-issue",
        "ship.combined-load-risk"
      ],
      "decisionPointIds": [
        "decision.combined-load-risk"
      ],
      "exitSignals": [
        "The integrated test has a committed status",
        "Any accepted technical debt is recorded"
      ]
    },
    {
      "id": "final-command-review",
      "title": "Final Command Review",
      "type": "review",
      "dayRange": "day 9",